
*** Running vivado
    with args -log top.vdi -applog -m64 -product Vivado -messageDb vivado.pb -mode batch -source top.tcl -notrace


****** Vivado v2018.2 (64-bit)
  **** SW Build 2258646 on Thu Jun 14 20:02:38 MDT 2018
  **** IP Build 2256618 on Thu Jun 14 22:10:49 MDT 2018
    ** Copyright 1986-2018 Xilinx, Inc. All Rights Reserved.

source top.tcl -notrace
Command: link_design -top top -part xc7a100tcsg324-3
Design is defaulting to srcset: sources_1
Design is defaulting to constrset: constrs_1
INFO: [Netlist 29-17] Analyzing 7 Unisim elements for replacement
INFO: [Netlist 29-28] Unisim Transformation completed in 0 CPU seconds
INFO: [Project 1-479] Netlist was created with Vivado 2018.2
INFO: [Device 21-403] Loading part xc7a100tcsg324-3
INFO: [Project 1-570] Preparing netlist for logic optimization
Parsing XDC File [/home/shantanu/digilent-xdc/Nexys-4-DDR-Master.xdc]
Finished Parsing XDC File [/home/shantanu/digilent-xdc/Nexys-4-DDR-Master.xdc]
INFO: [Opt 31-138] Pushed 0 inverter(s) to 0 load pin(s).
INFO: [Project 1-111] Unisim Transformation Summary:
No Unisim elements were transformed.

7 Infos, 0 Warnings, 0 Critical Warnings and 0 Errors encountered.
link_design completed successfully
link_design: Time (s): cpu = 00:00:06 ; elapsed = 00:00:13 . Memory (MB): peak = 1494.547 ; gain = 275.258 ; free physical = 1018 ; free virtual = 12056
Command: opt_design
Attempting to get a license for feature 'Implementation' and/or device 'xc7a100t'
INFO: [Common 17-349] Got license for feature 'Implementation' and/or device 'xc7a100t'
Running DRC as a precondition to command opt_design

Starting DRC Task
INFO: [DRC 23-27] Running DRC with 8 threads
INFO: [Project 1-461] DRC finished with 0 Errors
INFO: [Project 1-462] Please refer to the DRC report (report_drc) for more information.

Time (s): cpu = 00:00:01 ; elapsed = 00:00:01 . Memory (MB): peak = 1589.578 ; gain = 95.031 ; free physical = 1013 ; free virtual = 12051

Starting Cache Timing Information Task
INFO: [Timing 38-35] Done setting XDC timing constraints.
Ending Cache Timing Information Task | Checksum: 1088a1608

Time (s): cpu = 00:00:09 ; elapsed = 00:00:17 . Memory (MB): peak = 2027.078 ; gain = 437.500 ; free physical = 634 ; free virtual = 11672

Starting Logic Optimization Task

Phase 1 Retarget
INFO: [Opt 31-138] Pushed 0 inverter(s) to 0 load pin(s).
INFO: [Opt 31-49] Retargeted 0 cell(s).
Phase 1 Retarget | Checksum: 1088a1608

Time (s): cpu = 00:00:00.02 ; elapsed = 00:00:00.02 . Memory (MB): peak = 2027.078 ; gain = 0.000 ; free physical = 634 ; free virtual = 11672
INFO: [Opt 31-389] Phase Retarget created 0 cells and removed 0 cells

Phase 2 Constant propagation
INFO: [Opt 31-138] Pushed 0 inverter(s) to 0 load pin(s).
Phase 2 Constant propagation | Checksum: 1088a1608

Time (s): cpu = 00:00:00.02 ; elapsed = 00:00:00.02 . Memory (MB): peak = 2027.078 ; gain = 0.000 ; free physical = 634 ; free virtual = 11672
INFO: [Opt 31-389] Phase Constant propagation created 0 cells and removed 0 cells

Phase 3 Sweep
Phase 3 Sweep | Checksum: 1200591d3

Time (s): cpu = 00:00:00.02 ; elapsed = 00:00:00.02 . Memory (MB): peak = 2027.078 ; gain = 0.000 ; free physical = 634 ; free virtual = 11672
INFO: [Opt 31-389] Phase Sweep created 0 cells and removed 0 cells

Phase 4 BUFG optimization
Phase 4 BUFG optimization | Checksum: 1200591d3

Time (s): cpu = 00:00:00.03 ; elapsed = 00:00:00.02 . Memory (MB): peak = 2027.078 ; gain = 0.000 ; free physical = 634 ; free virtual = 11672
INFO: [Opt 31-662] Phase BUFG optimization created 0 cells of which 0 are BUFGs and removed 0 cells.

Phase 5 Shift Register Optimization
Phase 5 Shift Register Optimization | Checksum: 2036baace

Time (s): cpu = 00:00:00.03 ; elapsed = 00:00:00.03 . Memory (MB): peak = 2027.078 ; gain = 0.000 ; free physical = 634 ; free virtual = 11672
INFO: [Opt 31-389] Phase Shift Register Optimization created 0 cells and removed 0 cells

Phase 6 Post Processing Netlist
Phase 6 Post Processing Netlist | Checksum: 2036baace

Time (s): cpu = 00:00:00.03 ; elapsed = 00:00:00.03 . Memory (MB): peak = 2027.078 ; gain = 0.000 ; free physical = 634 ; free virtual = 11672
INFO: [Opt 31-389] Phase Post Processing Netlist created 0 cells and removed 0 cells

Starting Connectivity Check Task

Time (s): cpu = 00:00:00 ; elapsed = 00:00:00 . Memory (MB): peak = 2027.078 ; gain = 0.000 ; free physical = 634 ; free virtual = 11672
Ending Logic Optimization Task | Checksum: 2036baace

Time (s): cpu = 00:00:00.03 ; elapsed = 00:00:00.03 . Memory (MB): peak = 2027.078 ; gain = 0.000 ; free physical = 634 ; free virtual = 11672

Starting Power Optimization Task
INFO: [Pwropt 34-132] Skipping clock gating for clocks with a period < 2.00 ns.
Ending Power Optimization Task | Checksum: 2036baace

Time (s): cpu = 00:00:00.01 ; elapsed = 00:00:00.03 . Memory (MB): peak = 2027.078 ; gain = 0.000 ; free physical = 634 ; free virtual = 11672

Starting Final Cleanup Task
Ending Final Cleanup Task | Checksum: 2036baace

Time (s): cpu = 00:00:00 ; elapsed = 00:00:00 . Memory (MB): peak = 2027.078 ; gain = 0.000 ; free physical = 634 ; free virtual = 11672
INFO: [Common 17-83] Releasing license: Implementation
23 Infos, 0 Warnings, 0 Critical Warnings and 0 Errors encountered.
opt_design completed successfully
opt_design: Time (s): cpu = 00:00:11 ; elapsed = 00:00:18 . Memory (MB): peak = 2027.078 ; gain = 532.531 ; free physical = 634 ; free virtual = 11672
INFO: [Timing 38-480] Writing timing data to binary archive.
Writing placer database...
Writing XDEF routing.
Writing XDEF routing logical nets.
Writing XDEF routing special nets.
Write XDEF Complete: Time (s): cpu = 00:00:00.02 ; elapsed = 00:00:00.01 . Memory (MB): peak = 2059.094 ; gain = 0.000 ; free physical = 631 ; free virtual = 11671
INFO: [Common 17-1381] The checkpoint '/home/shantanu/TIFR/sync_counter-2/sync_counter.runs/impl_1/top_opt.dcp' has been generated.
INFO: [runtcl-4] Executing : report_drc -file top_drc_opted.rpt -pb top_drc_opted.pb -rpx top_drc_opted.rpx
Command: report_drc -file top_drc_opted.rpt -pb top_drc_opted.pb -rpx top_drc_opted.rpx
INFO: [IP_Flow 19-234] Refreshing IP repositories
INFO: [IP_Flow 19-1704] No user IP repositories specified
INFO: [IP_Flow 19-2313] Loaded Vivado IP repository '/home/shantanu/vivado/Vivado/2018.2/data/ip'.
INFO: [DRC 23-27] Running DRC with 8 threads
INFO: [Coretcl 2-168] The results of DRC are in file /home/shantanu/TIFR/sync_counter-2/sync_counter.runs/impl_1/top_drc_opted.rpt.
report_drc completed successfully
Command: place_design
Attempting to get a license for feature 'Implementation' and/or device 'xc7a100t'
INFO: [Common 17-349] Got license for feature 'Implementation' and/or device 'xc7a100t'
INFO: [DRC 23-27] Running DRC with 8 threads
INFO: [Vivado_Tcl 4-198] DRC finished with 0 Errors
INFO: [Vivado_Tcl 4-199] Please refer to the DRC report (report_drc) for more information.
Running DRC as a precondition to command place_design
INFO: [DRC 23-27] Running DRC with 8 threads
INFO: [Vivado_Tcl 4-198] DRC finished with 0 Errors
INFO: [Vivado_Tcl 4-199] Please refer to the DRC report (report_drc) for more information.

Starting Placer Task
INFO: [Place 30-611] Multithreading enabled for place_design using a maximum of 8 CPUs

Phase 1 Placer Initialization

Phase 1.1 Placer Initialization Netlist Sorting
Netlist sorting complete. Time (s): cpu = 00:00:00 ; elapsed = 00:00:00 . Memory (MB): peak = 2147.137 ; gain = 0.000 ; free physical = 588 ; free virtual = 11627
Phase 1.1 Placer Initialization Netlist Sorting | Checksum: 12f404e49

Time (s): cpu = 00:00:00.01 ; elapsed = 00:00:00.07 . Memory (MB): peak = 2147.137 ; gain = 0.000 ; free physical = 588 ; free virtual = 11627
Netlist sorting complete. Time (s): cpu = 00:00:00 ; elapsed = 00:00:00 . Memory (MB): peak = 2147.137 ; gain = 0.000 ; free physical = 588 ; free virtual = 11627

Phase 1.2 IO Placement/ Clock Placement/ Build Placer Device
INFO: [Timing 38-35] Done setting XDC timing constraints.
Phase 1.2 IO Placement/ Clock Placement/ Build Placer Device | Checksum: ed0f04a7

Time (s): cpu = 00:00:01 ; elapsed = 00:00:00.69 . Memory (MB): peak = 2147.137 ; gain = 0.000 ; free physical = 584 ; free virtual = 11627

Phase 1.3 Build Placer Netlist Model
Phase 1.3 Build Placer Netlist Model | Checksum: 135ee7afa

Time (s): cpu = 00:00:02 ; elapsed = 00:00:01 . Memory (MB): peak = 2165.770 ; gain = 18.633 ; free physical = 581 ; free virtual = 11626

Phase 1.4 Constrain Clocks/Macros
Phase 1.4 Constrain Clocks/Macros | Checksum: 135ee7afa

Time (s): cpu = 00:00:02 ; elapsed = 00:00:01 . Memory (MB): peak = 2165.770 ; gain = 18.633 ; free physical = 581 ; free virtual = 11626
Phase 1 Placer Initialization | Checksum: 135ee7afa

Time (s): cpu = 00:00:02 ; elapsed = 00:00:01 . Memory (MB): peak = 2165.770 ; gain = 18.633 ; free physical = 581 ; free virtual = 11626

Phase 2 Global Placement

Phase 2.1 Floorplanning
Phase 2.1 Floorplanning | Checksum: 1bb64597d

Time (s): cpu = 00:00:02 ; elapsed = 00:00:01 . Memory (MB): peak = 2253.812 ; gain = 106.676 ; free physical = 578 ; free virtual = 11623

Phase 2.2 Physical Synthesis In Placer
INFO: [Physopt 32-65] No nets found for high-fanout optimization.
INFO: [Physopt 32-232] Optimized 0 net. Created 0 new instance.
INFO: [Physopt 32-775] End 1 Pass. Optimized 0 net or cell. Created 0 new cell, deleted 0 existing cell and moved 0 existing cell
Netlist sorting complete. Time (s): cpu = 00:00:00 ; elapsed = 00:00:00 . Memory (MB): peak = 2253.812 ; gain = 0.000 ; free physical = 560 ; free virtual = 11607

Summary of Physical Synthesis Optimizations
============================================


-----------------------------------------------------------------------------------------------------------------------------
|  Optimization       |  Added Cells  |  Removed Cells  |  Optimized Cells/Nets  |  Dont Touch  |  Iterations  |  Elapsed   |
-----------------------------------------------------------------------------------------------------------------------------
|  Very High Fanout   |            0  |              0  |                     0  |           0  |           1  |  00:00:00  |
|  Total              |            0  |              0  |                     0  |           0  |           1  |  00:00:00  |
-----------------------------------------------------------------------------------------------------------------------------


Phase 2.2 Physical Synthesis In Placer | Checksum: 136e5ebcb

Time (s): cpu = 00:00:04 ; elapsed = 00:00:02 . Memory (MB): peak = 2253.812 ; gain = 106.676 ; free physical = 561 ; free virtual = 11608
Phase 2 Global Placement | Checksum: 1004af398

Time (s): cpu = 00:00:04 ; elapsed = 00:00:02 . Memory (MB): peak = 2253.812 ; gain = 106.676 ; free physical = 560 ; free virtual = 11607

Phase 3 Detail Placement

Phase 3.1 Commit Multi Column Macros
Phase 3.1 Commit Multi Column Macros | Checksum: 1004af398

Time (s): cpu = 00:00:04 ; elapsed = 00:00:02 . Memory (MB): peak = 2253.812 ; gain = 106.676 ; free physical = 560 ; free virtual = 11607

Phase 3.2 Commit Most Macros & LUTRAMs
Phase 3.2 Commit Most Macros & LUTRAMs | Checksum: 1d851b2c5

Time (s): cpu = 00:00:04 ; elapsed = 00:00:02 . Memory (MB): peak = 2253.812 ; gain = 106.676 ; free physical = 559 ; free virtual = 11606

Phase 3.3 Area Swap Optimization
Phase 3.3 Area Swap Optimization | Checksum: 217b6211c

Time (s): cpu = 00:00:04 ; elapsed = 00:00:02 . Memory (MB): peak = 2253.812 ; gain = 106.676 ; free physical = 560 ; free virtual = 11607

Phase 3.4 Pipeline Register Optimization
Phase 3.4 Pipeline Register Optimization | Checksum: 217b6211c

Time (s): cpu = 00:00:04 ; elapsed = 00:00:02 . Memory (MB): peak = 2253.812 ; gain = 106.676 ; free physical = 560 ; free virtual = 11607

Phase 3.5 Small Shape Detail Placement
Phase 3.5 Small Shape Detail Placement | Checksum: 1d77e1dc8

Time (s): cpu = 00:00:05 ; elapsed = 00:00:02 . Memory (MB): peak = 2253.812 ; gain = 106.676 ; free physical = 556 ; free virtual = 11604

Phase 3.6 Re-assign LUT pins
Phase 3.6 Re-assign LUT pins | Checksum: 1d77e1dc8

Time (s): cpu = 00:00:05 ; elapsed = 00:00:02 . Memory (MB): peak = 2253.812 ; gain = 106.676 ; free physical = 556 ; free virtual = 11604

Phase 3.7 Pipeline Register Optimization
Phase 3.7 Pipeline Register Optimization | Checksum: 1d77e1dc8

Time (s): cpu = 00:00:05 ; elapsed = 00:00:02 . Memory (MB): peak = 2253.812 ; gain = 106.676 ; free physical = 556 ; free virtual = 11604
Phase 3 Detail Placement | Checksum: 1d77e1dc8

Time (s): cpu = 00:00:05 ; elapsed = 00:00:02 . Memory (MB): peak = 2253.812 ; gain = 106.676 ; free physical = 556 ; free virtual = 11604

Phase 4 Post Placement Optimization and Clean-Up

Phase 4.1 Post Commit Optimization
INFO: [Timing 38-35] Done setting XDC timing constraints.

Phase 4.1.1 Post Placement Optimization
Post Placement Optimization Initialization | Checksum: 1b2949233

Phase 4.1.1.1 BUFG Insertion
INFO: [Place 46-31] BUFG insertion identified 0 candidate nets, 0 success, 0 skipped for placement/routing, 0 skipped for timing, 0 skipped for netlist change reason.
Phase 4.1.1.1 BUFG Insertion | Checksum: 1b2949233

Time (s): cpu = 00:00:05 ; elapsed = 00:00:02 . Memory (MB): peak = 2253.812 ; gain = 106.676 ; free physical = 556 ; free virtual = 11604
INFO: [Place 30-746] Post Placement Timing Summary WNS=7.488. For the most accurate timing information please run report_timing.
Phase 4.1.1 Post Placement Optimization | Checksum: 13638c6e9

Time (s): cpu = 00:00:05 ; elapsed = 00:00:02 . Memory (MB): peak = 2253.812 ; gain = 106.676 ; free physical = 556 ; free virtual = 11604
Phase 4.1 Post Commit Optimization | Checksum: 13638c6e9

Time (s): cpu = 00:00:05 ; elapsed = 00:00:02 . Memory (MB): peak = 2253.812 ; gain = 106.676 ; free physical = 556 ; free virtual = 11604

Phase 4.2 Post Placement Cleanup
Phase 4.2 Post Placement Cleanup | Checksum: 13638c6e9

Time (s): cpu = 00:00:06 ; elapsed = 00:00:02 . Memory (MB): peak = 2253.812 ; gain = 106.676 ; free physical = 557 ; free virtual = 11605

Phase 4.3 Placer Reporting
Phase 4.3 Placer Reporting | Checksum: 13638c6e9

Time (s): cpu = 00:00:06 ; elapsed = 00:00:02 . Memory (MB): peak = 2253.812 ; gain = 106.676 ; free physical = 557 ; free virtual = 11605

Phase 4.4 Final Placement Cleanup
Phase 4.4 Final Placement Cleanup | Checksum: 13638c6e9

Time (s): cpu = 00:00:06 ; elapsed = 00:00:02 . Memory (MB): peak = 2253.812 ; gain = 106.676 ; free physical = 557 ; free virtual = 11605
Phase 4 Post Placement Optimization and Clean-Up | Checksum: 13638c6e9

Time (s): cpu = 00:00:06 ; elapsed = 00:00:02 . Memory (MB): peak = 2253.812 ; gain = 106.676 ; free physical = 557 ; free virtual = 11605
Ending Placer Task | Checksum: df2fb5e3

Time (s): cpu = 00:00:06 ; elapsed = 00:00:02 . Memory (MB): peak = 2253.812 ; gain = 106.676 ; free physical = 573 ; free virtual = 11621
INFO: [Common 17-83] Releasing license: Implementation
47 Infos, 0 Warnings, 0 Critical Warnings and 0 Errors encountered.
place_design completed successfully
INFO: [Timing 38-480] Writing timing data to binary archive.
Writing placer database...
Writing XDEF routing.
Writing XDEF routing logical nets.
Writing XDEF routing special nets.
Write XDEF Complete: Time (s): cpu = 00:00:00.02 ; elapsed = 00:00:00 . Memory (MB): peak = 2253.812 ; gain = 0.000 ; free physical = 575 ; free virtual = 11624
INFO: [Common 17-1381] The checkpoint '/home/shantanu/TIFR/sync_counter-2/sync_counter.runs/impl_1/top_placed.dcp' has been generated.
INFO: [runtcl-4] Executing : report_io -file top_io_placed.rpt
report_io: Time (s): cpu = 00:00:00.09 ; elapsed = 00:00:00.11 . Memory (MB): peak = 2253.812 ; gain = 0.000 ; free physical = 567 ; free virtual = 11615
INFO: [runtcl-4] Executing : report_utilization -file top_utilization_placed.rpt -pb top_utilization_placed.pb
report_utilization: Time (s): cpu = 00:00:00.07 ; elapsed = 00:00:00.10 . Memory (MB): peak = 2253.812 ; gain = 0.000 ; free physical = 574 ; free virtual = 11622
INFO: [runtcl-4] Executing : report_control_sets -verbose -file top_control_sets_placed.rpt
report_control_sets: Time (s): cpu = 00:00:00.05 ; elapsed = 00:00:00.06 . Memory (MB): peak = 2253.812 ; gain = 0.000 ; free physical = 574 ; free virtual = 11622
Command: route_design
Attempting to get a license for feature 'Implementation' and/or device 'xc7a100t'
INFO: [Common 17-349] Got license for feature 'Implementation' and/or device 'xc7a100t'
Running DRC as a precondition to command route_design
INFO: [DRC 23-27] Running DRC with 8 threads
INFO: [Vivado_Tcl 4-198] DRC finished with 0 Errors
INFO: [Vivado_Tcl 4-199] Please refer to the DRC report (report_drc) for more information.


Starting Routing Task
INFO: [Route 35-254] Multithreading enabled for route_design using a maximum of 8 CPUs
Checksum: PlaceDB: 2f2c3586 ConstDB: 0 ShapeSum: b003805d RouteDB: 0

Phase 1 Build RT Design
Phase 1 Build RT Design | Checksum: 11f17dbb2

Time (s): cpu = 00:00:19 ; elapsed = 00:00:16 . Memory (MB): peak = 2296.441 ; gain = 42.629 ; free physical = 420 ; free virtual = 11469
Post Restoration Checksum: NetGraph: 37eb8bab NumContArr: e72c5007 Constraints: 0 Timing: 0

Phase 2 Router Initialization

Phase 2.1 Create Timer
Phase 2.1 Create Timer | Checksum: 11f17dbb2

Time (s): cpu = 00:00:19 ; elapsed = 00:00:16 . Memory (MB): peak = 2296.441 ; gain = 42.629 ; free physical = 420 ; free virtual = 11469

Phase 2.2 Fix Topology Constraints
Phase 2.2 Fix Topology Constraints | Checksum: 11f17dbb2

Time (s): cpu = 00:00:19 ; elapsed = 00:00:16 . Memory (MB): peak = 2303.430 ; gain = 49.617 ; free physical = 387 ; free virtual = 11437

Phase 2.3 Pre Route Cleanup
Phase 2.3 Pre Route Cleanup | Checksum: 11f17dbb2

Time (s): cpu = 00:00:19 ; elapsed = 00:00:16 . Memory (MB): peak = 2303.430 ; gain = 49.617 ; free physical = 387 ; free virtual = 11437
 Number of Nodes with overlaps = 0

Phase 2.4 Update Timing
Phase 2.4 Update Timing | Checksum: 1428995d0

Time (s): cpu = 00:00:19 ; elapsed = 00:00:16 . Memory (MB): peak = 2312.695 ; gain = 58.883 ; free physical = 379 ; free virtual = 11429
INFO: [Route 35-416] Intermediate Timing Summary | WNS=7.411  | TNS=0.000  | WHS=-0.123 | THS=-1.893 |

Phase 2 Router Initialization | Checksum: 18fd63ef1

Time (s): cpu = 00:00:19 ; elapsed = 00:00:16 . Memory (MB): peak = 2312.695 ; gain = 58.883 ; free physical = 379 ; free virtual = 11429

Phase 3 Initial Routing
Phase 3 Initial Routing | Checksum: 126014e59

Time (s): cpu = 00:00:20 ; elapsed = 00:00:16 . Memory (MB): peak = 2312.695 ; gain = 58.883 ; free physical = 380 ; free virtual = 11430

Phase 4 Rip-up And Reroute

Phase 4.1 Global Iteration 0
 Number of Nodes with overlaps = 0
INFO: [Route 35-416] Intermediate Timing Summary | WNS=7.266  | TNS=0.000  | WHS=N/A    | THS=N/A    |

Phase 4.1 Global Iteration 0 | Checksum: 19152587d

Time (s): cpu = 00:00:20 ; elapsed = 00:00:16 . Memory (MB): peak = 2312.695 ; gain = 58.883 ; free physical = 380 ; free virtual = 11430
Phase 4 Rip-up And Reroute | Checksum: 19152587d

Time (s): cpu = 00:00:20 ; elapsed = 00:00:16 . Memory (MB): peak = 2312.695 ; gain = 58.883 ; free physical = 380 ; free virtual = 11430

Phase 5 Delay and Skew Optimization

Phase 5.1 Delay CleanUp
Phase 5.1 Delay CleanUp | Checksum: 19152587d

Time (s): cpu = 00:00:20 ; elapsed = 00:00:16 . Memory (MB): peak = 2312.695 ; gain = 58.883 ; free physical = 380 ; free virtual = 11430

Phase 5.2 Clock Skew Optimization
Phase 5.2 Clock Skew Optimization | Checksum: 19152587d

Time (s): cpu = 00:00:20 ; elapsed = 00:00:16 . Memory (MB): peak = 2312.695 ; gain = 58.883 ; free physical = 380 ; free virtual = 11430
Phase 5 Delay and Skew Optimization | Checksum: 19152587d

Time (s): cpu = 00:00:20 ; elapsed = 00:00:16 . Memory (MB): peak = 2312.695 ; gain = 58.883 ; free physical = 380 ; free virtual = 11430

Phase 6 Post Hold Fix

Phase 6.1 Hold Fix Iter

Phase 6.1.1 Update Timing
Phase 6.1.1 Update Timing | Checksum: aa2fd251

Time (s): cpu = 00:00:20 ; elapsed = 00:00:16 . Memory (MB): peak = 2312.695 ; gain = 58.883 ; free physical = 380 ; free virtual = 11430
INFO: [Route 35-416] Intermediate Timing Summary | WNS=7.342  | TNS=0.000  | WHS=0.158  | THS=0.000  |

Phase 6.1 Hold Fix Iter | Checksum: aa2fd251

Time (s): cpu = 00:00:20 ; elapsed = 00:00:16 . Memory (MB): peak = 2312.695 ; gain = 58.883 ; free physical = 380 ; free virtual = 11430
Phase 6 Post Hold Fix | Checksum: aa2fd251

Time (s): cpu = 00:00:20 ; elapsed = 00:00:16 . Memory (MB): peak = 2312.695 ; gain = 58.883 ; free physical = 380 ; free virtual = 11430

Phase 7 Route finalize

Router Utilization Summary
  Global Vertical Routing Utilization    = 0.015015 %
  Global Horizontal Routing Utilization  = 0.0044757 %
  Routable Net Status*
  *Does not include unroutable nets such as driverless and loadless.
  Run report_route_status for detailed report.
  Number of Failed Nets               = 0
  Number of Unrouted Nets             = 0
  Number of Partially Routed Nets     = 0
  Number of Node Overlaps             = 0

Phase 7 Route finalize | Checksum: 110356d33

Time (s): cpu = 00:00:20 ; elapsed = 00:00:16 . Memory (MB): peak = 2312.695 ; gain = 58.883 ; free physical = 380 ; free virtual = 11430

Phase 8 Verifying routed nets

 Verification completed successfully
Phase 8 Verifying routed nets | Checksum: 110356d33

Time (s): cpu = 00:00:20 ; elapsed = 00:00:16 . Memory (MB): peak = 2312.695 ; gain = 58.883 ; free physical = 379 ; free virtual = 11429

Phase 9 Depositing Routes
Phase 9 Depositing Routes | Checksum: 1a01495c4

Time (s): cpu = 00:00:20 ; elapsed = 00:00:16 . Memory (MB): peak = 2312.695 ; gain = 58.883 ; free physical = 379 ; free virtual = 11429

Phase 10 Post Router Timing
INFO: [Route 35-57] Estimated Timing Summary | WNS=7.342  | TNS=0.000  | WHS=0.158  | THS=0.000  |

INFO: [Route 35-327] The final timing numbers are based on the router estimated timing analysis. For a complete and accurate timing signoff, please run report_timing_summary.
Phase 10 Post Router Timing | Checksum: 1a01495c4

Time (s): cpu = 00:00:20 ; elapsed = 00:00:16 . Memory (MB): peak = 2312.695 ; gain = 58.883 ; free physical = 380 ; free virtual = 11430
INFO: [Route 35-16] Router Completed Successfully

Time (s): cpu = 00:00:21 ; elapsed = 00:00:16 . Memory (MB): peak = 2312.695 ; gain = 58.883 ; free physical = 415 ; free virtual = 11465

Routing Is Done.
INFO: [Common 17-83] Releasing license: Implementation
64 Infos, 0 Warnings, 0 Critical Warnings and 0 Errors encountered.
route_design completed successfully
route_design: Time (s): cpu = 00:00:22 ; elapsed = 00:00:17 . Memory (MB): peak = 2312.695 ; gain = 58.883 ; free physical = 415 ; free virtual = 11465
INFO: [Timing 38-480] Writing timing data to binary archive.
Writing placer database...
Writing XDEF routing.
Writing XDEF routing logical nets.
Writing XDEF routing special nets.
Write XDEF Complete: Time (s): cpu = 00:00:00.03 ; elapsed = 00:00:00.01 . Memory (MB): peak = 2314.695 ; gain = 0.000 ; free physical = 414 ; free virtual = 11465
INFO: [Common 17-1381] The checkpoint '/home/shantanu/TIFR/sync_counter-2/sync_counter.runs/impl_1/top_routed.dcp' has been generated.
INFO: [runtcl-4] Executing : report_drc -file top_drc_routed.rpt -pb top_drc_routed.pb -rpx top_drc_routed.rpx
Command: report_drc -file top_drc_routed.rpt -pb top_drc_routed.pb -rpx top_drc_routed.rpx
INFO: [DRC 23-27] Running DRC with 8 threads
INFO: [Coretcl 2-168] The results of DRC are in file /home/shantanu/TIFR/sync_counter-2/sync_counter.runs/impl_1/top_drc_routed.rpt.
report_drc completed successfully
INFO: [runtcl-4] Executing : report_methodology -file top_methodology_drc_routed.rpt -pb top_methodology_drc_routed.pb -rpx top_methodology_drc_routed.rpx
Command: report_methodology -file top_methodology_drc_routed.rpt -pb top_methodology_drc_routed.pb -rpx top_methodology_drc_routed.rpx
INFO: [Timing 38-35] Done setting XDC timing constraints.
INFO: [Timing 38-35] Done setting XDC timing constraints.
INFO: [DRC 23-133] Running Methodology with 8 threads
INFO: [Coretcl 2-1520] The results of Report Methodology are in file /home/shantanu/TIFR/sync_counter-2/sync_counter.runs/impl_1/top_methodology_drc_routed.rpt.
report_methodology completed successfully
INFO: [runtcl-4] Executing : report_power -file top_power_routed.rpt -pb top_power_summary_routed.pb -rpx top_power_routed.rpx
Command: report_power -file top_power_routed.rpt -pb top_power_summary_routed.pb -rpx top_power_routed.rpx
INFO: [Timing 38-35] Done setting XDC timing constraints.
Running Vector-less Activity Propagation...

Finished Running Vector-less Activity Propagation
76 Infos, 0 Warnings, 0 Critical Warnings and 0 Errors encountered.
report_power completed successfully
INFO: [runtcl-4] Executing : report_route_status -file top_route_status.rpt -pb top_route_status.pb
INFO: [runtcl-4] Executing : report_timing_summary -max_paths 10 -file top_timing_summary_routed.rpt -pb top_timing_summary_routed.pb -rpx top_timing_summary_routed.rpx -warn_on_violation 
INFO: [Timing 38-91] UpdateTimingParams: Speed grade: -3, Delay Type: min_max, Timing Stage: Requireds.
INFO: [Timing 38-191] Multithreading enabled for timing update using a maximum of 8 CPUs
INFO: [runtcl-4] Executing : report_incremental_reuse -file top_incremental_reuse_routed.rpt
INFO: [Vivado_Tcl 4-545] No incremental reuse to report, no incremental placement and routing data was found.
INFO: [runtcl-4] Executing : report_clock_utilization -file top_clock_utilization_routed.rpt
INFO: [runtcl-4] Executing : report_bus_skew -warn_on_violation -file top_bus_skew_routed.rpt -pb top_bus_skew_routed.pb -rpx top_bus_skew_routed.rpx
INFO: [Timing 38-91] UpdateTimingParams: Speed grade: -3, Delay Type: min_max, Timing Stage: Requireds.
INFO: [Timing 38-191] Multithreading enabled for timing update using a maximum of 8 CPUs
Command: write_bitstream -force top.bit
Attempting to get a license for feature 'Implementation' and/or device 'xc7a100t'
INFO: [Common 17-349] Got license for feature 'Implementation' and/or device 'xc7a100t'
Running DRC as a precondition to command write_bitstream
INFO: [DRC 23-27] Running DRC with 8 threads
WARNING: [DRC CFGBVS-1] Missing CFGBVS and CONFIG_VOLTAGE Design Properties: Neither the CFGBVS nor CONFIG_VOLTAGE voltage property is set in the current_design.  Configuration bank voltage select (CFGBVS) must be set to VCCO or GND, and CONFIG_VOLTAGE must be set to the correct configuration voltage, in order to determine the I/O voltage support for the pins in bank 0.  It is suggested to specify these either using the 'Edit Device Properties' function in the GUI or directly in the XDC file using the following syntax:

 set_property CFGBVS value1 [current_design]
 #where value1 is either VCCO or GND

 set_property CONFIG_VOLTAGE value2 [current_design]
 #where value2 is the voltage provided to configuration bank 0

Refer to the device configuration user guide for more information.
INFO: [Vivado 12-3199] DRC finished with 0 Errors, 1 Warnings
INFO: [Vivado 12-3200] Please refer to the DRC report (report_drc) for more information.
INFO: [Designutils 20-2272] Running write_bitstream with 8 threads.
Loading data files...
Loading site data...
Loading route data...
Processing options...
Creating bitmap...
Creating bitstream...
Writing bitstream ./top.bit...
INFO: [Vivado 12-1842] Bitgen Completed Successfully.
INFO: [Project 1-120] WebTalk data collection is mandatory when using a WebPACK part without a full Vivado license. To see the specific WebTalk data collected for your design, open the usage_statistics_webtalk.html or usage_statistics_webtalk.xml file in the implementation directory.
INFO: [Common 17-186] '/home/shantanu/TIFR/sync_counter-2/sync_counter.runs/impl_1/usage_statistics_webtalk.xml' has been successfully sent to Xilinx on Sat Sep  7 14:13:03 2019. For additional details about this file, please refer to the WebTalk help file at /home/shantanu/vivado/Vivado/2018.2/doc/webtalk_introduction.html.
INFO: [Common 17-83] Releasing license: Implementation
95 Infos, 1 Warnings, 0 Critical Warnings and 0 Errors encountered.
write_bitstream completed successfully
write_bitstream: Time (s): cpu = 00:00:09 ; elapsed = 00:00:16 . Memory (MB): peak = 2647.594 ; gain = 228.820 ; free physical = 474 ; free virtual = 11445
INFO: [Common 17-206] Exiting Vivado at Sat Sep  7 14:13:03 2019...

*** Running vivado
    with args -log top.vdi -applog -m64 -product Vivado -messageDb vivado.pb -mode batch -source top.tcl -notrace


****** Vivado v2018.2 (64-bit)
  **** SW Build 2258646 on Thu Jun 14 20:02:38 MDT 2018
  **** IP Build 2256618 on Thu Jun 14 22:10:49 MDT 2018
    ** Copyright 1986-2018 Xilinx, Inc. All Rights Reserved.

source top.tcl -notrace
Command: open_checkpoint top_routed.dcp

Starting open_checkpoint Task

Time (s): cpu = 00:00:00.05 ; elapsed = 00:00:00.07 . Memory (MB): peak = 1186.266 ; gain = 0.000 ; free physical = 1405 ; free virtual = 12377
INFO: [Netlist 29-17] Analyzing 7 Unisim elements for replacement
INFO: [Netlist 29-28] Unisim Transformation completed in 0 CPU seconds
INFO: [Project 1-479] Netlist was created with Vivado 2018.2
INFO: [Device 21-403] Loading part xc7a100tcsg324-3
INFO: [Project 1-570] Preparing netlist for logic optimization
INFO: [Timing 38-478] Restoring timing data from binary archive.
INFO: [Timing 38-479] Binary timing data restore complete.
INFO: [Project 1-856] Restoring constraints from binary archive.
INFO: [Project 1-853] Binary constraint restore complete.
Reading XDEF placement.
Reading placer database...
Reading XDEF routing.
Read XDEF File: Time (s): cpu = 00:00:00.09 ; elapsed = 00:00:00.12 . Memory (MB): peak = 1974.262 ; gain = 0.000 ; free physical = 697 ; free virtual = 11670
Restored from archive | CPU: 0.130000 secs | Memory: 0.993439 MB |
Finished XDEF File Restore: Time (s): cpu = 00:00:00.09 ; elapsed = 00:00:00.12 . Memory (MB): peak = 1974.262 ; gain = 0.000 ; free physical = 697 ; free virtual = 11670
INFO: [Project 1-111] Unisim Transformation Summary:
No Unisim elements were transformed.

INFO: [Project 1-604] Checkpoint was created with Vivado v2018.2 (64-bit) build 2258646
open_checkpoint: Time (s): cpu = 00:00:16 ; elapsed = 00:00:31 . Memory (MB): peak = 1974.262 ; gain = 787.996 ; free physical = 697 ; free virtual = 11669
Command: write_bitstream -force top.bit
Attempting to get a license for feature 'Implementation' and/or device 'xc7a100t'
INFO: [Common 17-349] Got license for feature 'Implementation' and/or device 'xc7a100t'
Running DRC as a precondition to command write_bitstream
INFO: [IP_Flow 19-234] Refreshing IP repositories
INFO: [IP_Flow 19-1704] No user IP repositories specified
INFO: [IP_Flow 19-2313] Loaded Vivado IP repository '/home/shantanu/vivado/Vivado/2018.2/data/ip'.
INFO: [DRC 23-27] Running DRC with 8 threads
WARNING: [DRC CFGBVS-1] Missing CFGBVS and CONFIG_VOLTAGE Design Properties: Neither the CFGBVS nor CONFIG_VOLTAGE voltage property is set in the current_design.  Configuration bank voltage select (CFGBVS) must be set to VCCO or GND, and CONFIG_VOLTAGE must be set to the correct configuration voltage, in order to determine the I/O voltage support for the pins in bank 0.  It is suggested to specify these either using the 'Edit Device Properties' function in the GUI or directly in the XDC file using the following syntax:

 set_property CFGBVS value1 [current_design]
 #where value1 is either VCCO or GND

 set_property CONFIG_VOLTAGE value2 [current_design]
 #where value2 is the voltage provided to configuration bank 0

Refer to the device configuration user guide for more information.
INFO: [Vivado 12-3199] DRC finished with 0 Errors, 1 Warnings
INFO: [Vivado 12-3200] Please refer to the DRC report (report_drc) for more information.
INFO: [Designutils 20-2272] Running write_bitstream with 8 threads.
Loading data files...
Loading site data...
Loading route data...
Processing options...
Creating bitmap...
Creating bitstream...
Writing bitstream ./top.bit...
INFO: [Vivado 12-1842] Bitgen Completed Successfully.
INFO: [Project 1-120] WebTalk data collection is mandatory when using a WebPACK part without a full Vivado license. To see the specific WebTalk data collected for your design, open the usage_statistics_webtalk.html or usage_statistics_webtalk.xml file in the implementation directory.
INFO: [Common 17-186] '/home/shantanu/TIFR/sync_counter-2/sync_counter.runs/impl_1/usage_statistics_webtalk.xml' has been successfully sent to Xilinx on Sat Sep  7 14:16:05 2019. For additional details about this file, please refer to the WebTalk help file at /home/shantanu/vivado/Vivado/2018.2/doc/webtalk_introduction.html.
INFO: [Common 17-83] Releasing license: Implementation
23 Infos, 1 Warnings, 0 Critical Warnings and 0 Errors encountered.
write_bitstream completed successfully
write_bitstream: Time (s): cpu = 00:00:10 ; elapsed = 00:00:16 . Memory (MB): peak = 2447.109 ; gain = 472.848 ; free physical = 628 ; free virtual = 11605
INFO: [Common 17-206] Exiting Vivado at Sat Sep  7 14:16:05 2019...
